{
  "namespace": "exercise_media",
  "version": 1,
  "baseUrl": "https://pub-7eb72a1a315f4da3b30100ff6e694651.r2.dev",
  "exercises": [
    {"exerciseId":116,"exerciseName":"Jump Squat","slug":"jump_squat","assets":[{"assetId":"jump_squat_thumb_v1","type":"thumbnail","path":"exercises/jump_squat/v1/thumb.webp","localFile":"build\\content\\exercise_media_batch_007\\exercises\\jump_squat\\v1\\thumb.webp","title":"Jump Squat thumbnail","sortOrder":0,"version":1,"licenseId":"tonos_owned"}]},
    {"exerciseId":117,"exerciseName":"Jump Squat - Dumbbell","slug":"jump_squat_dumbbell","assets":[{"assetId":"jump_squat_dumbbell_thumb_v1","type":"thumbnail","path":"exercises/jump_squat_dumbbell/v1/thumb.webp","localFile":"build\\content\\exercise_media_batch_007\\exercises\\jump_squat_dumbbell\\v1\\thumb.webp","title":"Jump Squat - Dumbbell thumbnail","sortOrder":0,"version":1,"licenseId":"tonos_owned"}]},
    {"exerciseId":126,"exerciseName":"Kneeling Pull-down","slug":"kneeling_pull_down","assets":[{"assetId":"kneeling_pull_down_thumb_v1","type":"thumbnail","path":"exercises/kneeling_pull_down/v1/thumb.webp","localFile":"build\\content\\exercise_media_batch_007\\exercises\\kneeling_pull_down\\v1\\thumb.webp","title":"Kneeling Pull-down thumbnail","sortOrder":0,"version":1,"licenseId":"tonos_owned"}]},
    {"exerciseId":127,"exerciseName":"Kneeling Tricep Extension","slug":"kneeling_tricep_extension","assets":[{"assetId":"kneeling_tricep_extension_thumb_v1","type":"thumbnail","path":"exercises/kneeling_tricep_extension/v1/thumb.webp","localFile":"build\\content\\exercise_media_batch_007\\exercises\\kneeling_tricep_extension\\v1\\thumb.webp","title":"Kneeling Tricep Extension thumbnail","sortOrder":0,"version":1,"licenseId":"tonos_owned"}]},
    {"exerciseId":128,"exerciseName":"Landmine Press - Landmine Attachment","slug":"landmine_press_landmine_attachment","assets":[{"assetId":"landmine_press_landmine_attachment_thumb_v1","type":"thumbnail","path":"exercises/landmine_press_landmine_attachment/v1/thumb.webp","localFile":"build\\content\\exercise_media_batch_007\\exercises\\landmine_press_landmine_attachment\\v1\\thumb.webp","title":"Landmine Press - Landmine Attachment thumbnail","sortOrder":0,"version":1,"licenseId":"tonos_owned"}]},
    {"exerciseId":129,"exerciseName":"Landmine Thruster - Landmine Attachment","slug":"landmine_thruster_landmine_attachment","assets":[{"assetId":"landmine_thruster_landmine_attachment_thumb_v1","type":"thumbnail","path":"exercises/landmine_thruster_landmine_attachment/v1/thumb.webp","localFile":"build\\content\\exercise_media_batch_007\\exercises\\landmine_thruster_landmine_attachment\\v1\\thumb.webp","title":"Landmine Thruster - Landmine Attachment thumbnail","sortOrder":0,"version":1,"licenseId":"tonos_owned"}]},
    {"exerciseId":137,"exerciseName":"Lateral Raise - Dumbbell (Straight Arm)","slug":"lateral_raise_dumbbell_straight_arm","assets":[{"assetId":"lateral_raise_dumbbell_straight_arm_thumb_v1","type":"thumbnail","path":"exercises/lateral_raise_dumbbell_straight_arm/v1/thumb.webp","localFile":"build\\content\\exercise_media_batch_007\\exercises\\lateral_raise_dumbbell_straight_arm\\v1\\thumb.webp","title":"Lateral Raise - Dumbbell (Straight Arm) thumbnail","sortOrder":0,"version":1,"licenseId":"tonos_owned"}]},
    {"exerciseId":138,"exerciseName":"Lateral Raise - Dumbbell (Bent Arm)","slug":"lateral_raise_dumbbell_bent_arm","assets":[{"assetId":"lateral_raise_dumbbell_bent_arm_thumb_v1","type":"thumbnail","path":"exercises/lateral_raise_dumbbell_bent_arm/v1/thumb.webp","localFile":"build\\content\\exercise_media_batch_007\\exercises\\lateral_raise_dumbbell_bent_arm\\v1\\thumb.webp","title":"Lateral Raise - Dumbbell (Bent Arm) thumbnail","sortOrder":0,"version":1,"licenseId":"tonos_owned"}]},
    {"exerciseId":143,"exerciseName":"Lying Leg Raise","slug":"leg_raise","assets":[{"assetId":"leg_raise_thumb_v1","type":"thumbnail","path":"exercises/leg_raise/v1/thumb.webp","localFile":"build\\content\\exercise_media_batch_007\\exercises\\leg_raise\\v1\\thumb.webp","title":"Lying Leg Raise thumbnail","sortOrder":0,"version":1,"licenseId":"tonos_owned"}]},
    {"exerciseId":144,"exerciseName":"Hanging Leg Raise","slug":"leg_raise_hanging","assets":[{"assetId":"leg_raise_hanging_thumb_v1","type":"thumbnail","path":"exercises/leg_raise_hanging/v1/thumb.webp","localFile":"build\\content\\exercise_media_batch_007\\exercises\\leg_raise_hanging\\v1\\thumb.webp","title":"Hanging Leg Raise thumbnail","sortOrder":0,"version":1,"licenseId":"tonos_owned"}]},
    {"exerciseId":156,"exerciseName":"Mountain Climber","slug":"mountain_climber","assets":[{"assetId":"mountain_climber_thumb_v1","type":"thumbnail","path":"exercises/mountain_climber/v1/thumb.webp","localFile":"build\\content\\exercise_media_batch_007\\exercises\\mountain_climber\\v1\\thumb.webp","title":"Mountain Climber thumbnail","sortOrder":0,"version":1,"licenseId":"tonos_owned"}]},
    {"exerciseId":158,"exerciseName":"Muscle Up","slug":"muscle_up","assets":[{"assetId":"muscle_up_thumb_v1","type":"thumbnail","path":"exercises/muscle_up/v1/thumb.webp","localFile":"build\\content\\exercise_media_batch_007\\exercises\\muscle_up\\v1\\thumb.webp","title":"Muscle Up thumbnail","sortOrder":0,"version":1,"licenseId":"tonos_owned"}]},
    {"exerciseId":159,"exerciseName":"Oblique Crunch","slug":"oblique_crunch","assets":[{"assetId":"oblique_crunch_thumb_v1","type":"thumbnail","path":"exercises/oblique_crunch/v1/thumb.webp","localFile":"build\\content\\exercise_media_batch_007\\exercises\\oblique_crunch\\v1\\thumb.webp","title":"Oblique Crunch thumbnail","sortOrder":0,"version":1,"licenseId":"tonos_owned"}]},
    {"exerciseId":160,"exerciseName":"Oblique V-Up","slug":"oblique_v_up","assets":[{"assetId":"oblique_v_up_thumb_v1","type":"thumbnail","path":"exercises/oblique_v_up/v1/thumb.webp","localFile":"build\\content\\exercise_media_batch_007\\exercises\\oblique_v_up\\v1\\thumb.webp","title":"Oblique V-Up thumbnail","sortOrder":0,"version":1,"licenseId":"tonos_owned"}]},
    {"exerciseId":161,"exerciseName":"Overhead Press - Cable Machine","slug":"overhead_press_cable_machine","assets":[{"assetId":"overhead_press_cable_machine_thumb_v1","type":"thumbnail","path":"exercises/overhead_press_cable_machine/v1/thumb.webp","localFile":"build\\content\\exercise_media_batch_007\\exercises\\overhead_press_cable_machine\\v1\\thumb.webp","title":"Overhead Press - Cable Machine thumbnail","sortOrder":0,"version":1,"licenseId":"tonos_owned"}]},
    {"exerciseId":162,"exerciseName":"Overhead Press - Barbell","slug":"overhead_press_barbell","assets":[{"assetId":"overhead_press_barbell_thumb_v1","type":"thumbnail","path":"exercises/overhead_press_barbell/v1/thumb.webp","localFile":"build\\content\\exercise_media_batch_007\\exercises\\overhead_press_barbell\\v1\\thumb.webp","title":"Overhead Press - Barbell thumbnail","sortOrder":0,"version":1,"licenseId":"tonos_owned"}]},
    {"exerciseId":163,"exerciseName":"Overhead Press - Dumbbell","slug":"overhead_press_dumbbell","assets":[{"assetId":"overhead_press_dumbbell_thumb_v1","type":"thumbnail","path":"exercises/overhead_press_dumbbell/v1/thumb.webp","localFile":"build\\content\\exercise_media_batch_007\\exercises\\overhead_press_dumbbell\\v1\\thumb.webp","title":"Overhead Press - Dumbbell thumbnail","sortOrder":0,"version":1,"licenseId":"tonos_owned"}]},
    {"exerciseId":164,"exerciseName":"Overhead Squat - Barbell","slug":"overhead_squat_barbell","assets":[{"assetId":"overhead_squat_barbell_thumb_v1","type":"thumbnail","path":"exercises/overhead_squat_barbell/v1/thumb.webp","localFile":"build\\content\\exercise_media_batch_007\\exercises\\overhead_squat_barbell\\v1\\thumb.webp","title":"Overhead Squat - Barbell thumbnail","sortOrder":0,"version":1,"licenseId":"tonos_owned"}]},
    {"exerciseId":165,"exerciseName":"Overhead Squat - Dumbbell","slug":"overhead_squat_dumbbell","assets":[{"assetId":"overhead_squat_dumbbell_thumb_v1","type":"thumbnail","path":"exercises/overhead_squat_dumbbell/v1/thumb.webp","localFile":"build\\content\\exercise_media_batch_007\\exercises\\overhead_squat_dumbbell\\v1\\thumb.webp","title":"Overhead Squat - Dumbbell thumbnail","sortOrder":0,"version":1,"licenseId":"tonos_owned"}]},
    {"exerciseId":166,"exerciseName":"Pec Deck Fly","slug":"pec_deck_fly","assets":[{"assetId":"pec_deck_fly_thumb_v1","type":"thumbnail","path":"exercises/pec_deck_fly/v1/thumb.webp","localFile":"build\\content\\exercise_media_batch_007\\exercises\\pec_deck_fly\\v1\\thumb.webp","title":"Pec Deck Fly thumbnail","sortOrder":0,"version":1,"licenseId":"tonos_owned"}]}
  ]
}
