{
  "namespace": "exercise_media",
  "version": 1,
  "baseUrl": "https://pub-7eb72a1a315f4da3b30100ff6e694651.r2.dev",
  "exercises": [
    {"exerciseId": 13, "exerciseName": "Bicep Curl - Bodyweight", "slug": "bicep_curl_bodyweight", "assets": [{"assetId": "bicep_curl_bodyweight_thumb_v1", "type": "thumbnail", "path": "exercises/bicep_curl_bodyweight/v1/thumb.webp", "localFile": "build\\content\\exercise_media_batch_004\\exercises\\bicep_curl_bodyweight\\v1\\thumb.webp", "title": "Bicep Curl - Bodyweight thumbnail", "sortOrder": 0, "version": 1, "licenseId": "tonos_owned"}]},
    {"exerciseId": 25, "exerciseName": "Calf Raise - Standing Calf Raise Machine", "slug": "calf_raise_standing_calf_raise_machine", "assets": [{"assetId": "calf_raise_standing_calf_raise_machine_thumb_v1", "type": "thumbnail", "path": "exercises/calf_raise_standing_calf_raise_machine/v1/thumb.webp", "localFile": "build\\content\\exercise_media_batch_004\\exercises\\calf_raise_standing_calf_raise_machine\\v1\\thumb.webp", "title": "Calf Raise - Standing Calf Raise Machine thumbnail", "sortOrder": 0, "version": 1, "licenseId": "tonos_owned"}]},
    {"exerciseId": 26, "exerciseName": "Calf Raise - Dumbbell", "slug": "calf_raise_dumbbell", "assets": [{"assetId": "calf_raise_dumbbell_thumb_v1", "type": "thumbnail", "path": "exercises/calf_raise_dumbbell/v1/thumb.webp", "localFile": "build\\content\\exercise_media_batch_004\\exercises\\calf_raise_dumbbell\\v1\\thumb.webp", "title": "Calf Raise - Dumbbell thumbnail", "sortOrder": 0, "version": 1, "licenseId": "tonos_owned"}]},
    {"exerciseId": 27, "exerciseName": "Chest Dip", "slug": "chest_dip", "assets": [{"assetId": "chest_dip_thumb_v1", "type": "thumbnail", "path": "exercises/chest_dip/v1/thumb.webp", "localFile": "build\\content\\exercise_media_batch_004\\exercises\\chest_dip\\v1\\thumb.webp", "title": "Chest Dip thumbnail", "sortOrder": 0, "version": 1, "licenseId": "tonos_owned"}]},
    {"exerciseId": 47, "exerciseName": "Curtsey Lunge", "slug": "curtsey_lunge", "assets": [{"assetId": "curtsey_lunge_thumb_v1", "type": "thumbnail", "path": "exercises/curtsey_lunge/v1/thumb.webp", "localFile": "build\\content\\exercise_media_batch_004\\exercises\\curtsey_lunge\\v1\\thumb.webp", "title": "Curtsey Lunge thumbnail", "sortOrder": 0, "version": 1, "licenseId": "tonos_owned"}]},
    {"exerciseId": 48, "exerciseName": "Curtsey Lunge - Dumbbell", "slug": "curtsey_lunge_dumbbell", "assets": [{"assetId": "curtsey_lunge_dumbbell_thumb_v1", "type": "thumbnail", "path": "exercises/curtsey_lunge_dumbbell/v1/thumb.webp", "localFile": "build\\content\\exercise_media_batch_004\\exercises\\curtsey_lunge_dumbbell\\v1\\thumb.webp", "title": "Curtsey Lunge - Dumbbell thumbnail", "sortOrder": 0, "version": 1, "licenseId": "tonos_owned"}]},
    {"exerciseId": 52, "exerciseName": "Diamond Push-up", "slug": "diamond_push_up", "assets": [{"assetId": "diamond_push_up_thumb_v1", "type": "thumbnail", "path": "exercises/diamond_push_up/v1/thumb.webp", "localFile": "build\\content\\exercise_media_batch_004\\exercises\\diamond_push_up\\v1\\thumb.webp", "title": "Diamond Push-up thumbnail", "sortOrder": 0, "version": 1, "licenseId": "tonos_owned"}]},
    {"exerciseId": 53, "exerciseName": "Donkey Kick", "slug": "donkey_kick", "assets": [{"assetId": "donkey_kick_thumb_v1", "type": "thumbnail", "path": "exercises/donkey_kick/v1/thumb.webp", "localFile": "build\\content\\exercise_media_batch_004\\exercises\\donkey_kick\\v1\\thumb.webp", "title": "Donkey Kick thumbnail", "sortOrder": 0, "version": 1, "licenseId": "tonos_owned"}]},
    {"exerciseId": 55, "exerciseName": "Down-Up Twist - Cable Machine", "slug": "down_up_twist_cable_machine", "assets": [{"assetId": "down_up_twist_cable_machine_thumb_v1", "type": "thumbnail", "path": "exercises/down_up_twist_cable_machine/v1/thumb.webp", "localFile": "build\\content\\exercise_media_batch_004\\exercises\\down_up_twist_cable_machine\\v1\\thumb.webp", "title": "Down-Up Twist - Cable Machine thumbnail", "sortOrder": 0, "version": 1, "licenseId": "tonos_owned"}]},
    {"exerciseId": 56, "exerciseName": "Drag Curl - Cable Machine", "slug": "drag_curl_cable_machine", "assets": [{"assetId": "drag_curl_cable_machine_thumb_v1", "type": "thumbnail", "path": "exercises/drag_curl_cable_machine/v1/thumb.webp", "localFile": "build\\content\\exercise_media_batch_004\\exercises\\drag_curl_cable_machine\\v1\\thumb.webp", "title": "Drag Curl - Cable Machine thumbnail", "sortOrder": 0, "version": 1, "licenseId": "tonos_owned"}]},
    {"exerciseId": 57, "exerciseName": "Drag Curl - Barbell", "slug": "drag_curl_barbell", "assets": [{"assetId": "drag_curl_barbell_thumb_v1", "type": "thumbnail", "path": "exercises/drag_curl_barbell/v1/thumb.webp", "localFile": "build\\content\\exercise_media_batch_004\\exercises\\drag_curl_barbell\\v1\\thumb.webp", "title": "Drag Curl - Barbell thumbnail", "sortOrder": 0, "version": 1, "licenseId": "tonos_owned"}]},
    {"exerciseId": 58, "exerciseName": "Drag Curl - Dumbbell", "slug": "drag_curl_dumbbell", "assets": [{"assetId": "drag_curl_dumbbell_thumb_v1", "type": "thumbnail", "path": "exercises/drag_curl_dumbbell/v1/thumb.webp", "localFile": "build\\content\\exercise_media_batch_004\\exercises\\drag_curl_dumbbell\\v1\\thumb.webp", "title": "Drag Curl - Dumbbell thumbnail", "sortOrder": 0, "version": 1, "licenseId": "tonos_owned"}]},
    {"exerciseId": 59, "exerciseName": "External Rotation - Cable Machine", "slug": "external_rotation_cable_machine", "assets": [{"assetId": "external_rotation_cable_machine_thumb_v1", "type": "thumbnail", "path": "exercises/external_rotation_cable_machine/v1/thumb.webp", "localFile": "build\\content\\exercise_media_batch_004\\exercises\\external_rotation_cable_machine\\v1\\thumb.webp", "title": "External Rotation - Cable Machine thumbnail", "sortOrder": 0, "version": 1, "licenseId": "tonos_owned"}]},
    {"exerciseId": 62, "exerciseName": "Farmers Carry - Dumbbell", "slug": "farmers_carry_dumbbell", "assets": [{"assetId": "farmers_carry_dumbbell_thumb_v1", "type": "thumbnail", "path": "exercises/farmers_carry_dumbbell/v1/thumb.webp", "localFile": "build\\content\\exercise_media_batch_004\\exercises\\farmers_carry_dumbbell\\v1\\thumb.webp", "title": "Farmers Carry - Dumbbell thumbnail", "sortOrder": 0, "version": 1, "licenseId": "tonos_owned"}]},
    {"exerciseId": 63, "exerciseName": "Fire Hydrant", "slug": "fire_hydrant", "assets": [{"assetId": "fire_hydrant_thumb_v1", "type": "thumbnail", "path": "exercises/fire_hydrant/v1/thumb.webp", "localFile": "build\\content\\exercise_media_batch_004\\exercises\\fire_hydrant\\v1\\thumb.webp", "title": "Fire Hydrant thumbnail", "sortOrder": 0, "version": 1, "licenseId": "tonos_owned"}]},
    {"exerciseId": 64, "exerciseName": "Floor Press - Dumbbell", "slug": "floor_press_dumbbell", "assets": [{"assetId": "floor_press_dumbbell_thumb_v1", "type": "thumbnail", "path": "exercises/floor_press_dumbbell/v1/thumb.webp", "localFile": "build\\content\\exercise_media_batch_004\\exercises\\floor_press_dumbbell\\v1\\thumb.webp", "title": "Floor Press - Dumbbell thumbnail", "sortOrder": 0, "version": 1, "licenseId": "tonos_owned"}]},
    {"exerciseId": 65, "exerciseName": "Floor Press - Barbell", "slug": "floor_press_barbell", "assets": [{"assetId": "floor_press_barbell_thumb_v1", "type": "thumbnail", "path": "exercises/floor_press_barbell/v1/thumb.webp", "localFile": "build\\content\\exercise_media_batch_004\\exercises\\floor_press_barbell\\v1\\thumb.webp", "title": "Floor Press - Barbell thumbnail", "sortOrder": 0, "version": 1, "licenseId": "tonos_owned"}]},
    {"exerciseId": 66, "exerciseName": "Front Raise - Cable Machine", "slug": "front_raise_cable_machine", "assets": [{"assetId": "front_raise_cable_machine_thumb_v1", "type": "thumbnail", "path": "exercises/front_raise_cable_machine/v1/thumb.webp", "localFile": "build\\content\\exercise_media_batch_004\\exercises\\front_raise_cable_machine\\v1\\thumb.webp", "title": "Front Raise - Cable Machine thumbnail", "sortOrder": 0, "version": 1, "licenseId": "tonos_owned"}]}
  ]
}
