{
  "namespace": "exercise_media",
  "version": 1,
  "baseUrl": "https://pub-7eb72a1a315f4da3b30100ff6e694651.r2.dev",
  "exercises": [
    {
      "exerciseId": 1,
      "exerciseName": "Ab Wheel",
      "slug": "ab_wheel",
      "assets": [
        {
          "assetId": "ab_wheel_thumb_v1",
          "type": "thumbnail",
          "path": "exercises/ab_wheel/v1/thumb.webp",
          "localFile": "build/content/exercise_media_batch_001/exercises/ab_wheel/v1/thumb.webp",
          "title": "Ab Wheel thumbnail",
          "sortOrder": 0,
          "version": 1,
          "licenseId": "tonos_test"
        }
      ]
    },
    {
      "exerciseId": 2,
      "exerciseName": "Arm Circles",
      "slug": "arm_circles",
      "assets": [
        {
          "assetId": "arm_circles_thumb_v1",
          "type": "thumbnail",
          "path": "exercises/arm_circles/v1/thumb.webp",
          "localFile": "build/content/exercise_media_batch_001/exercises/arm_circles/v1/thumb.webp",
          "title": "Arm Circles thumbnail",
          "sortOrder": 0,
          "version": 1,
          "licenseId": "tonos_test"
        }
      ]
    },
    {
      "exerciseId": 3,
      "exerciseName": "Arnold Press",
      "slug": "arnold_press",
      "assets": [
        {
          "assetId": "arnold_press_thumb_v1",
          "type": "thumbnail",
          "path": "exercises/arnold_press/v1/thumb.webp",
          "localFile": "build/content/exercise_media_batch_001/exercises/arnold_press/v1/thumb.webp",
          "title": "Arnold Press thumbnail",
          "sortOrder": 0,
          "version": 1,
          "licenseId": "tonos_test"
        }
      ]
    },
    {
      "exerciseId": 4,
      "exerciseName": "Back Extension",
      "slug": "back_extension",
      "assets": [
        {
          "assetId": "back_extension_thumb_v1",
          "type": "thumbnail",
          "path": "exercises/back_extension/v1/thumb.webp",
          "localFile": "build/content/exercise_media_batch_001/exercises/back_extension/v1/thumb.webp",
          "title": "Back Extension thumbnail",
          "sortOrder": 0,
          "version": 1,
          "licenseId": "tonos_test"
        }
      ]
    },
    {
      "exerciseId": 5,
      "exerciseName": "Ball Slam",
      "slug": "ball_slam",
      "assets": [
        {
          "assetId": "ball_slam_thumb_v1",
          "type": "thumbnail",
          "path": "exercises/ball_slam/v1/thumb.webp",
          "localFile": "build/content/exercise_media_batch_001/exercises/ball_slam/v1/thumb.webp",
          "title": "Ball Slam thumbnail",
          "sortOrder": 0,
          "version": 1,
          "licenseId": "tonos_test"
        }
      ]
    },
    {
      "exerciseId": 8,
      "exerciseName": "Bench Press - Barbell (Close Grip)",
      "slug": "bench_press_barbell_close_grip",
      "assets": [
        {
          "assetId": "bench_press_barbell_close_grip_thumb_v1",
          "type": "thumbnail",
          "path": "exercises/bench_press_barbell_close_grip/v1/thumb.webp",
          "localFile": "build/content/exercise_media_batch_001/exercises/bench_press_barbell_close_grip/v1/thumb.webp",
          "title": "Bench Press - Barbell (Close Grip) thumbnail",
          "sortOrder": 0,
          "version": 1,
          "licenseId": "tonos_test"
        }
      ]
    },
    {
      "exerciseId": 9,
      "exerciseName": "Bench Press - Dumbbells",
      "slug": "bench_press_dumbbells",
      "assets": [
        {
          "assetId": "bench_press_dumbbells_thumb_v1",
          "type": "thumbnail",
          "path": "exercises/bench_press_dumbbells/v1/thumb.webp",
          "localFile": "build/content/exercise_media_batch_001/exercises/bench_press_dumbbells/v1/thumb.webp",
          "title": "Bench Press - Dumbbells thumbnail",
          "sortOrder": 0,
          "version": 1,
          "licenseId": "tonos_test"
        }
      ]
    },
    {
      "exerciseId": 10,
      "exerciseName": "Bench Press - Smith Machine",
      "slug": "bench_press_smith_machine",
      "assets": [
        {
          "assetId": "bench_press_smith_machine_thumb_v1",
          "type": "thumbnail",
          "path": "exercises/bench_press_smith_machine/v1/thumb.webp",
          "localFile": "build/content/exercise_media_batch_001/exercises/bench_press_smith_machine/v1/thumb.webp",
          "title": "Bench Press - Smith Machine thumbnail",
          "sortOrder": 0,
          "version": 1,
          "licenseId": "tonos_test"
        }
      ]
    },
    {
      "exerciseId": 11,
      "exerciseName": "Bench Press - Cable Machine",
      "slug": "bench_press_cable_machine",
      "assets": [
        {
          "assetId": "bench_press_cable_machine_thumb_v1",
          "type": "thumbnail",
          "path": "exercises/bench_press_cable_machine/v1/thumb.webp",
          "localFile": "build/content/exercise_media_batch_001/exercises/bench_press_cable_machine/v1/thumb.webp",
          "title": "Bench Press - Cable Machine thumbnail",
          "sortOrder": 0,
          "version": 1,
          "licenseId": "tonos_test"
        }
      ]
    },
    {
      "exerciseId": 12,
      "exerciseName": "Bicep Curl - Barbell",
      "slug": "bicep_curl_barbell",
      "assets": [
        {
          "assetId": "bicep_curl_barbell_thumb_v1",
          "type": "thumbnail",
          "path": "exercises/bicep_curl_barbell/v1/thumb.webp",
          "localFile": "build/content/exercise_media_batch_001/exercises/bicep_curl_barbell/v1/thumb.webp",
          "title": "Bicep Curl - Barbell thumbnail",
          "sortOrder": 0,
          "version": 1,
          "licenseId": "tonos_test"
        }
      ]
    }
  ]
}
