{
  "namespace": "exercise_media",
  "version": 1,
  "baseUrl": "https://pub-7eb72a1a315f4da3b30100ff6e694651.r2.dev",
  "exercises": [
    {"exerciseId":97,"exerciseName":"In-And-Out","slug":"in_and_out","assets":[{"assetId":"in_and_out_thumb_v1","type":"thumbnail","path":"exercises/in_and_out/v1/thumb.webp","localFile":"build\\content\\exercise_media_batch_006\\exercises\\in_and_out\\v1\\thumb.webp","title":"In-And-Out thumbnail","sortOrder":0,"version":1,"licenseId":"tonos_owned"}]},
    {"exerciseId":98,"exerciseName":"In-And-Out - Dumbbell","slug":"in_and_out_dumbbell","assets":[{"assetId":"in_and_out_dumbbell_thumb_v1","type":"thumbnail","path":"exercises/in_and_out_dumbbell/v1/thumb.webp","localFile":"build\\content\\exercise_media_batch_006\\exercises\\in_and_out_dumbbell\\v1\\thumb.webp","title":"In-And-Out - Dumbbell thumbnail","sortOrder":0,"version":1,"licenseId":"tonos_owned"}]},
    {"exerciseId":99,"exerciseName":"Incline Around the World - Dumbbell","slug":"incline_around_the_world_dumbbell","assets":[{"assetId":"incline_around_the_world_dumbbell_thumb_v1","type":"thumbnail","path":"exercises/incline_around_the_world_dumbbell/v1/thumb.webp","localFile":"build\\content\\exercise_media_batch_006\\exercises\\incline_around_the_world_dumbbell\\v1\\thumb.webp","title":"Incline Around the World - Dumbbell thumbnail","sortOrder":0,"version":1,"licenseId":"tonos_owned"}]},
    {"exerciseId":103,"exerciseName":"Incline Bench Press - Barbell","slug":"incline_bench_press_barbell","assets":[{"assetId":"incline_bench_press_barbell_thumb_v1","type":"thumbnail","path":"exercises/incline_bench_press_barbell/v1/thumb.webp","localFile":"build\\content\\exercise_media_batch_006\\exercises\\incline_bench_press_barbell\\v1\\thumb.webp","title":"Incline Bench Press - Barbell thumbnail","sortOrder":0,"version":1,"licenseId":"tonos_owned"}]},
    {"exerciseId":104,"exerciseName":"Incline Bench Press - Dumbbell","slug":"incline_bench_press_dumbbell","assets":[{"assetId":"incline_bench_press_dumbbell_thumb_v1","type":"thumbnail","path":"exercises/incline_bench_press_dumbbell/v1/thumb.webp","localFile":"build\\content\\exercise_media_batch_006\\exercises\\incline_bench_press_dumbbell\\v1\\thumb.webp","title":"Incline Bench Press - Dumbbell thumbnail","sortOrder":0,"version":1,"licenseId":"tonos_owned"}]},
    {"exerciseId":105,"exerciseName":"Incline Bicep Curl - Dumbbell","slug":"incline_bicep_curl_dumbbell","assets":[{"assetId":"incline_bicep_curl_dumbbell_thumb_v1","type":"thumbnail","path":"exercises/incline_bicep_curl_dumbbell/v1/thumb.webp","localFile":"build\\content\\exercise_media_batch_006\\exercises\\incline_bicep_curl_dumbbell\\v1\\thumb.webp","title":"Incline Bicep Curl - Dumbbell thumbnail","sortOrder":0,"version":1,"licenseId":"tonos_owned"}]},
    {"exerciseId":108,"exerciseName":"Incline Leg Press","slug":"incline_leg_press","assets":[{"assetId":"incline_leg_press_thumb_v1","type":"thumbnail","path":"exercises/incline_leg_press/v1/thumb.webp","localFile":"build\\content\\exercise_media_batch_006\\exercises\\incline_leg_press\\v1\\thumb.webp","title":"Incline Leg Press thumbnail","sortOrder":0,"version":1,"licenseId":"tonos_owned"}]},
    {"exerciseId":109,"exerciseName":"Incline Push-Up","slug":"incline_push_up","assets":[{"assetId":"incline_push_up_thumb_v1","type":"thumbnail","path":"exercises/incline_push_up/v1/thumb.webp","localFile":"build\\content\\exercise_media_batch_006\\exercises\\incline_push_up\\v1\\thumb.webp","title":"Incline Push-Up thumbnail","sortOrder":0,"version":1,"licenseId":"tonos_owned"}]},
    {"exerciseId":110,"exerciseName":"Incline Reverse Fly - Dumbbell","slug":"incline_reverse_fly_dumbbell","assets":[{"assetId":"incline_reverse_fly_dumbbell_thumb_v1","type":"thumbnail","path":"exercises/incline_reverse_fly_dumbbell/v1/thumb.webp","localFile":"build\\content\\exercise_media_batch_006\\exercises\\incline_reverse_fly_dumbbell\\v1\\thumb.webp","title":"Incline Reverse Fly - Dumbbell thumbnail","sortOrder":0,"version":1,"licenseId":"tonos_owned"}]},
    {"exerciseId":111,"exerciseName":"Incline Row - Cable Machine","slug":"incline_row_cable_machine","assets":[{"assetId":"incline_row_cable_machine_thumb_v1","type":"thumbnail","path":"exercises/incline_row_cable_machine/v1/thumb.webp","localFile":"build\\content\\exercise_media_batch_006\\exercises\\incline_row_cable_machine\\v1\\thumb.webp","title":"Incline Row - Cable Machine thumbnail","sortOrder":0,"version":1,"licenseId":"tonos_owned"}]},
    {"exerciseId":112,"exerciseName":"Incline Row - Dumbbell","slug":"incline_row_dumbbell","assets":[{"assetId":"incline_row_dumbbell_thumb_v1","type":"thumbnail","path":"exercises/incline_row_dumbbell/v1/thumb.webp","localFile":"build\\content\\exercise_media_batch_006\\exercises\\incline_row_dumbbell\\v1\\thumb.webp","title":"Incline Row - Dumbbell thumbnail","sortOrder":0,"version":1,"licenseId":"tonos_owned"}]},
    {"exerciseId":113,"exerciseName":"Internal Rotation - Cable Machine","slug":"internal_rotation_cable_machine","assets":[{"assetId":"internal_rotation_cable_machine_thumb_v1","type":"thumbnail","path":"exercises/internal_rotation_cable_machine/v1/thumb.webp","localFile":"build\\content\\exercise_media_batch_006\\exercises\\internal_rotation_cable_machine\\v1\\thumb.webp","title":"Internal Rotation - Cable Machine thumbnail","sortOrder":0,"version":1,"licenseId":"tonos_owned"}]},
    {"exerciseId":114,"exerciseName":"Inverted Row","slug":"inverted_row","assets":[{"assetId":"inverted_row_thumb_v1","type":"thumbnail","path":"exercises/inverted_row/v1/thumb.webp","localFile":"build\\content\\exercise_media_batch_006\\exercises\\inverted_row\\v1\\thumb.webp","title":"Inverted Row thumbnail","sortOrder":0,"version":1,"licenseId":"tonos_owned"}]}
  ]
}
